{
  "version": 1,
  "title": "example-voting-app Architecture",
  "direction": "LR",
  "sketch": true,
  "theme": "brand-logos",
  "groups": [
    {
      "id": "runtime",
      "label": "Application Runtime",
      "evidence": []
    },
    {
      "id": "data",
      "label": "Data Stores",
      "evidence": []
    }
  ],
  "nodes": [
    {
      "id": "user",
      "label": "User",
      "kind": "actor",
      "subtitle": "Web / API client",
      "evidence": [
        {
          "path": "README.md",
          "line": 1,
          "note": "user-facing application"
        }
      ]
    },
    {
      "id": "api-vote",
      "label": "Backend API",
      "kind": "service",
      "subtitle": "Flask",
      "evidence": [
        {
          "path": "vote/requirements.txt",
          "line": 1,
          "note": "Flask application manifest"
        },
        {
          "path": "vote/app.py",
          "line": 1,
          "note": "runtime entry point"
        },
        {
          "path": "docker-compose.yml",
          "line": 6,
          "note": "Docker Compose deployment"
        }
      ],
      "parent": "runtime"
    },
    {
      "id": "compose-result",
      "label": "Result",
      "kind": "service",
      "subtitle": "Docker service",
      "evidence": [
        {
          "path": "docker-compose.yml",
          "line": 27,
          "note": "Docker Compose service"
        }
      ],
      "parent": "runtime"
    },
    {
      "id": "compose-worker",
      "label": "Worker",
      "kind": "service",
      "subtitle": "Docker service",
      "evidence": [
        {
          "path": "docker-compose.yml",
          "line": 43,
          "note": "Docker Compose service"
        }
      ],
      "parent": "runtime"
    },
    {
      "id": "compose-redis",
      "label": "Redis",
      "kind": "queue",
      "subtitle": "redis",
      "evidence": [
        {
          "path": "docker-compose.yml",
          "line": 11,
          "note": "Docker Compose service"
        },
        {
          "path": "vote/requirements.txt",
          "line": 2,
          "note": "Redis client dependency"
        }
      ],
      "parent": "data"
    },
    {
      "id": "compose-db",
      "label": "PostgreSQL",
      "kind": "database",
      "subtitle": "postgres",
      "evidence": [
        {
          "path": "docker-compose.yml",
          "line": 32,
          "note": "Docker Compose service"
        }
      ],
      "parent": "data"
    },
    {
      "id": "compose-seed",
      "label": "Seed",
      "kind": "service",
      "subtitle": "Docker service",
      "evidence": [
        {
          "path": "docker-compose.yml",
          "line": 78,
          "note": "Docker Compose service"
        }
      ],
      "parent": "runtime"
    }
  ],
  "edges": [
    {
      "id": "edge-api-vote-compose-redis",
      "from": "api-vote",
      "to": "compose-redis",
      "label": "read / write",
      "evidence": [
        {
          "path": "docker-compose.yml",
          "line": 10,
          "note": "Docker Compose dependency"
        },
        {
          "path": "vote/requirements.txt",
          "line": 2,
          "note": "uses Redis"
        }
      ]
    },
    {
      "id": "edge-compose-result-compose-db",
      "from": "compose-result",
      "to": "compose-db",
      "label": "depends on",
      "evidence": [
        {
          "path": "docker-compose.yml",
          "line": 10,
          "note": "Docker Compose dependency"
        }
      ]
    },
    {
      "id": "edge-compose-worker-compose-redis",
      "from": "compose-worker",
      "to": "compose-redis",
      "label": "depends on",
      "evidence": [
        {
          "path": "docker-compose.yml",
          "line": 10,
          "note": "Docker Compose dependency"
        }
      ]
    },
    {
      "id": "edge-compose-worker-compose-db",
      "from": "compose-worker",
      "to": "compose-db",
      "label": "depends on",
      "evidence": [
        {
          "path": "docker-compose.yml",
          "line": 10,
          "note": "Docker Compose dependency"
        }
      ]
    },
    {
      "id": "edge-compose-seed-api-vote",
      "from": "compose-seed",
      "to": "api-vote",
      "label": "depends on",
      "evidence": [
        {
          "path": "docker-compose.yml",
          "line": 10,
          "note": "Docker Compose dependency"
        }
      ]
    },
    {
      "id": "edge-user-api-vote",
      "from": "user",
      "to": "api-vote",
      "label": "access (inferred)",
      "evidence": [
        {
          "path": "README.md",
          "line": 1,
          "note": "user entry point"
        }
      ]
    },
    {
      "id": "edge-user-compose-result",
      "from": "user",
      "to": "compose-result",
      "label": "published port",
      "evidence": [
        {
          "path": "docker-compose.yml",
          "line": 21,
          "note": "Compose publishes a port; protocol and audience need review"
        }
      ]
    }
  ]
}
